{
  "schema_version": "idfrepair.support_registry.v1",
  "registry_id": "idfrepair.support_registry.v1",
  "disabled_provider_names": [
    "airboundary_reference",
    "geometry_four_point",
    "geometry_pair",
    "geometry_snap",
    "kg623_reference",
    "osm_reference",
    "qwen3-1.7b",
    "qwen3-8b",
    "repair_memory"
  ],
  "entries": [
    {
      "entry_id": "syntax_delimiter_safe_auto",
      "mechanism_id": "syntax_delimiter",
      "provider_name": "syntax_delimiter",
      "family": "syntax",
      "support_status": "safe-auto",
      "public_enabled": true,
      "automatic_policy": "allowed",
      "requires_user_confirmation": false,
      "supported_energyplus_versions": ["24.1", "24.2", "25.1", "25.2", "26.1"],
      "supported_error_signatures": ["missing object delimiter"],
      "supported_object_types": ["*"],
      "supported_field_roles": ["object delimiter"],
      "required_evidence": ["diagnostic-bound missing terminal delimiter"],
      "required_runtime_assets": ["EnergyPlus executable", "bound IDD"],
      "rejection_conditions": ["delimiter location is ambiguous", "patch changes a non-delimiter span"],
      "user_input_conditions": [],
      "candidate_limit": 1,
      "operation_allowlist": ["insert_delimiter"],
      "provenance_policy": "deterministic-only",
      "evaluation_exposure": "development-regression",
      "evidence_references": ["reports/core_confirmation/full300_confirmation.json"],
      "conditional_correct": {"numerator": 30, "denominator": 30},
      "exact_correct": {"numerator": 30, "denominator": 30},
      "control_correct": {"numerator": 10, "denominator": 10},
      "wrong_modification": {"numerator": 0, "denominator": 40},
      "wbr": {"numerator": 0, "denominator": 40},
      "partial_as_full": null,
      "process_failure": {"numerator": 0, "denominator": 40},
      "notes_zh": "仅限冻结开发回归中可定位的分隔符缺失；不代表任意语法错误均受支持。",
      "notes_en": "Limited to the diagnostic-bound delimiter contract in the frozen development regression suite."
    },
    {
      "entry_id": "extra_field_idd_safe_auto",
      "mechanism_id": "extra_field_idd",
      "provider_name": "idd_schema",
      "family": "extra_field",
      "support_status": "safe-auto",
      "public_enabled": true,
      "automatic_policy": "allowed",
      "requires_user_confirmation": false,
      "supported_energyplus_versions": ["24.1", "24.2", "25.1", "25.2", "26.1"],
      "supported_error_signatures": ["extra field beyond bound IDD object definition"],
      "supported_object_types": ["*"],
      "supported_field_roles": ["field beyond maximum IDD index"],
      "required_evidence": ["root family is extra_field", "object is uniquely bound", "field exceeds bound IDD schema"],
      "required_runtime_assets": ["EnergyPlus executable", "bound IDD"],
      "rejection_conditions": ["root family is generic schema", "object binding is ambiguous", "field is declared by the bound IDD"],
      "user_input_conditions": [],
      "candidate_limit": 1,
      "operation_allowlist": ["delete_field"],
      "provenance_policy": "deterministic-only",
      "evaluation_exposure": "development-regression",
      "evidence_references": ["reports/core_confirmation/full300_confirmation.json"],
      "conditional_correct": {"numerator": 30, "denominator": 30},
      "exact_correct": {"numerator": 30, "denominator": 30},
      "control_correct": {"numerator": 10, "denominator": 10},
      "wrong_modification": {"numerator": 0, "denominator": 40},
      "wbr": {"numerator": 0, "denominator": 40},
      "partial_as_full": null,
      "process_failure": {"numerator": 0, "denominator": 40},
      "notes_zh": "只登记 extra_field 契约；SchemaProvider 的其他 schema 机制不因此获得 safe-auto。",
      "notes_en": "Registers only the extra-field contract, not every SchemaProvider mechanism."
    },
    {
      "entry_id": "finite_key_unique_typo_safe_auto",
      "mechanism_id": "finite_key_unique_typo",
      "provider_name": "finite_key",
      "family": "finite_key",
      "support_status": "safe-auto",
      "public_enabled": true,
      "automatic_policy": "allowed",
      "requires_user_confirmation": false,
      "supported_energyplus_versions": ["24.1", "24.2", "25.1", "25.2", "26.1"],
      "supported_error_signatures": ["whole-file IDD finite key has one bounded typo match"],
      "supported_object_types": ["*"],
      "supported_field_roles": ["finite_key"],
      "required_evidence": ["exact runtime and IDD identity", "finite current-version key set", "unique edit-distance one or two candidate"],
      "required_runtime_assets": ["EnergyPlus executable", "bound IDD"],
      "rejection_conditions": ["continuous numeric field", "candidate tie", "value not in current IDD key set"],
      "user_input_conditions": ["finite key candidate is not unique"],
      "candidate_limit": 1,
      "operation_allowlist": ["replace_field"],
      "provenance_policy": "deterministic-only",
      "evaluation_exposure": "generalization-dev-only",
      "evidence_references": ["reports/generalization_recovery/dev_baseline.json"],
      "conditional_correct": null,
      "exact_correct": null,
      "control_correct": null,
      "wrong_modification": null,
      "wbr": null,
      "partial_as_full": null,
      "process_failure": null,
      "notes_zh": "只允许当前 IDD 有限 key 的唯一近邻 typo；连续数值和设计参数永不进入该 Provider。",
      "notes_en": "Only a unique bounded typo in a finite current-IDD key set is eligible; continuous design values are excluded."
    },
    {
      "entry_id": "object_reference_unique_typo_safe_auto",
      "mechanism_id": "object_reference_unique_typo",
      "provider_name": "object_reference",
      "family": "object_reference",
      "support_status": "safe-auto",
      "public_enabled": true,
      "automatic_policy": "allowed",
      "requires_user_confirmation": false,
      "supported_energyplus_versions": ["24.1", "24.2", "25.1", "25.2", "26.1"],
      "supported_error_signatures": ["whole-file IDD object-list has one bounded typo match"],
      "supported_object_types": ["*"],
      "supported_field_roles": ["object_reference"],
      "required_evidence": ["exact runtime and IDD identity", "field-bound object-list", "unique existing target with no competing solution"],
      "required_runtime_assets": ["EnergyPlus executable", "bound IDD"],
      "rejection_conditions": ["Schedule role", "candidate tie", "missing target outside current object-list"],
      "user_input_conditions": ["object-list target is ambiguous"],
      "candidate_limit": 1,
      "operation_allowlist": ["rename_reference"],
      "provenance_policy": "deterministic-only",
      "evaluation_exposure": "generalization-dev-only",
      "evidence_references": ["reports/generalization_recovery/dev_baseline.json"],
      "conditional_correct": null,
      "exact_correct": null,
      "control_correct": null,
      "wrong_modification": null,
      "wbr": null,
      "partial_as_full": null,
      "process_failure": null,
      "notes_zh": "仅修复字段角色和 object-list 均绑定、且现有目标唯一最近的引用 typo。",
      "notes_en": "Limited to a field-bound object-list typo with one uniquely nearest existing target."
    },
    {
      "entry_id": "schedule_reference_safe_auto",
      "mechanism_id": "schedule_reference",
      "provider_name": "schedule_reference",
      "family": "reference_schedule",
      "support_status": "safe-auto",
      "public_enabled": true,
      "automatic_policy": "allowed",
      "requires_user_confirmation": false,
      "supported_energyplus_versions": ["24.1", "24.2", "25.1", "25.2", "26.1"],
      "supported_error_signatures": ["invalid schedule reference"],
      "supported_object_types": ["*"],
      "supported_field_roles": ["schedule_reference"],
      "required_evidence": ["bound IDD schedule role", "unique same-role target"],
      "required_runtime_assets": ["EnergyPlus executable", "bound IDD"],
      "rejection_conditions": ["cross-role schedule copy", "target is not unique"],
      "user_input_conditions": [],
      "candidate_limit": 1,
      "operation_allowlist": ["rename_reference"],
      "provenance_policy": "deterministic-only",
      "evaluation_exposure": "development-regression",
      "evidence_references": ["reports/core_confirmation/full300_confirmation.json"],
      "conditional_correct": {"numerator": 30, "denominator": 30},
      "exact_correct": {"numerator": 30, "denominator": 30},
      "control_correct": {"numerator": 10, "denominator": 10},
      "wrong_modification": {"numerator": 0, "denominator": 40},
      "wbr": {"numerator": 0, "denominator": 40},
      "partial_as_full": null,
      "process_failure": {"numerator": 0, "denominator": 40},
      "notes_zh": "必须保持 Schedule 角色一致并由现有语义门禁验证。",
      "notes_en": "Requires same-role schedule evidence and the existing semantic validator."
    },
    {
      "entry_id": "output_variable_rdd_safe_auto",
      "mechanism_id": "output_variable_rdd",
      "provider_name": "rdd_output",
      "family": "output_variable",
      "support_status": "safe-auto",
      "public_enabled": true,
      "automatic_policy": "allowed",
      "requires_user_confirmation": false,
      "supported_energyplus_versions": ["24.1", "24.2", "25.1", "25.2", "26.1"],
      "supported_error_signatures": ["invalid Output:Variable name"],
      "supported_object_types": ["Output:Variable"],
      "supported_field_roles": ["output_variable"],
      "required_evidence": ["version-bound RDD", "unique RDD variable match"],
      "required_runtime_assets": ["EnergyPlus executable", "bound IDD", "runtime-generated RDD"],
      "rejection_conditions": ["RDD unavailable", "RDD match is ambiguous"],
      "user_input_conditions": [],
      "candidate_limit": 1,
      "operation_allowlist": ["replace_field"],
      "provenance_policy": "deterministic-only",
      "evaluation_exposure": "development-regression",